[
  {
    "id": 9,
    "title": "National Education Summit - Melbourne",
    "uni": "unimelb",
    "date": "2026-09-03",
    "endDate": "2026-09-04",
    "type": "conference",
    "desc": "Melbourne Convention and Exhibition Centre.",
    "verified": true,
    "url": "https://nationaleducationsummit.com.au/"
  },
  {
    "id": 10,
    "title": "AIEC 2026",
    "uni": "usyd",
    "date": "2026-10-27",
    "endDate": "2026-10-30",
    "type": "conference",
    "desc": "40th anniversary in Sydney. Theme: 'Future Thinking'.",
    "verified": true,
    "url": "https://aiec.idp.com/"
  },
  {
    "id": 11,
    "title": "ASCILITE 2026",
    "uni": "qut",
    "date": "2026-11-29",
    "endDate": "2026-12-02",
    "type": "conference",
    "desc": "Rydges Southbank, Brisbane.",
    "verified": true,
    "url": "https://2026conference.ascilite.org/"
  },
  {
    "id": 14,
    "title": "UNSW Education Festival",
    "uni": "unsw",
    "date": "2026-11-16",
    "endDate": "2026-11-25",
    "type": "week",
    "desc": "Annual festival. Cross-faculty showcases.",
    "verified": true,
    "url": "https://www.education.unsw.edu.au/news-events/unsw-education-festival"
  },
  {
    "id": 20,
    "title": "UQ Teaching & Learning Week",
    "uni": "uq",
    "date": "2026-11-02",
    "endDate": "2026-11-06",
    "type": "week",
    "desc": "ITaLI's flagship week celebrating teaching excellence.",
    "verified": false
  },
  {
    "id": 22,
    "title": "Deakin Teaching & Learning Conference",
    "uni": "deakin",
    "date": "2026-10-14",
    "endDate": "2026-10-15",
    "type": "conference",
    "desc": "DTeach conference on inclusive teaching.",
    "verified": false
  },
  {
    "id": 23,
    "title": "Monash Education Academy Showcase",
    "uni": "monash",
    "date": "2026-10-07",
    "endDate": "2026-10-08",
    "type": "showcase",
    "desc": "MEA fellowship projects and teaching innovations.",
    "verified": false
  },
  {
    "id": 24,
    "title": "UniMelb Teaching & Learning Showcase",
    "uni": "unimelb",
    "date": "2026-10-21",
    "endDate": "2026-10-22",
    "type": "showcase",
    "desc": "Annual showcase of teaching practice.",
    "verified": false
  },
  {
    "id": 25,
    "title": "Sydney Teaching Symposium",
    "uni": "usyd",
    "date": "2026-09-16",
    "endDate": "2026-09-17",
    "type": "symposium",
    "desc": "USyd's annual symposium — practical, transferable, student-centred teaching (Educational Innovation). Date TBC.",
    "url": "https://educational-innovation.sydney.edu.au/teaching@sydney/about-educational-innovation/workshops-and-events/",
    "verified": false
  },
  {
    "id": 26,
    "title": "QUT L&T Symposium",
    "uni": "qut",
    "date": "2026-10-28",
    "type": "symposium",
    "desc": "Learning design, digital pedagogy, first-year experience.",
    "verified": false
  },
  {
    "id": 95,
    "title": "UNE L&T Symposium: Student Voice & Engagement",
    "uni": "une",
    "date": "2026-07-21",
    "type": "symposium",
    "desc": "UNE full-day L&T Symposium — student voice & student engagement. Keynote: Prof Jason Lodge (UQ). Online via Zoom, 10am AEST. Convened by Dr Kashmira Davé.",
    "verified": true,
    "url": "https://symposium.une.edu.au/symposium-2026/student-voice-student-engagement/"
  },
  {
    "id": 96,
    "title": "Global Students as Partners Roundtable 2026",
    "uni": "usyd",
    "date": "2026-10-01",
    "endDate": "2026-10-02",
    "type": "symposium",
    "desc": "\"Living the Claims: Embedding Equity for Authentic Partnership in a Changing World.\" Co-hosted by USyd Business School & Faculty of Science. Day 1 (1 Oct) development workshop; Day 2 (2 Oct) hybrid conference. CFP closes 29 Jun 2026.",
    "verified": true,
    "url": "https://events.humanitix.com/2026-global-students-as-partners-roundtable"
  },
  {
    "id": 97,
    "title": "AAEE 2026 — Make the Impossible, Possible",
    "uni": "unsw",
    "date": "2026-12-13",
    "endDate": "2026-12-16",
    "type": "conference",
    "desc": "37th Australasian Association for Engineering Education conference at UNSW — scholarly engineering education, innovative teaching practices and workshops.",
    "verified": true,
    "url": "https://aaee.net.au/"
  },
  {
    "id": 27,
    "title": "ANU Teaching Celebration",
    "uni": "anu",
    "date": "2026-10-15",
    "type": "showcase",
    "desc": "Outstanding teaching contributions.",
    "verified": false
  },
  {
    "id": 28,
    "title": "UTAS Teaching Matters",
    "uni": "utas",
    "date": "2026-11-11",
    "type": "conference",
    "desc": "Annual conference on teaching and learning.",
    "verified": false
  },
  {
    "id": 29,
    "title": "Griffith L&T Week",
    "uni": "griffith",
    "date": "2026-10-19",
    "endDate": "2026-10-23",
    "type": "week",
    "desc": "Workshops, awards, and community events.",
    "verified": false
  },
  {
    "id": 30,
    "title": "RMIT Learning & Teaching Festival",
    "uni": "rmit",
    "date": "2026-09-23",
    "type": "conference",
    "desc": "Multi-day cross-campus festival (Melbourne + Vietnam) — innovative teaching and GenAI responses. Date TBC.",
    "url": "https://www.rmit.edu.au/events",
    "verified": false
  },
  {
    "id": 31,
    "title": "UTS Learning & Teaching Forum",
    "uni": "uts",
    "date": "2026-11-04",
    "endDate": "2026-11-05",
    "type": "conference",
    "desc": "UTS's whole-of-university forum — blended learning, authentic assessment; closes with the VC's L&T Awards. Date TBC.",
    "url": "https://www.uts.edu.au/about/uts-vision/teaching/scholarship-and-research/learning-and-teaching-events/uts-teaching-and-learning-forum",
    "verified": false
  },
  {
    "id": 32,
    "title": "Curtin Teaching Excellence Week",
    "uni": "curtin",
    "date": "2026-10-05",
    "endDate": "2026-10-09",
    "type": "week",
    "desc": "Workshops, masterclasses, and awards.",
    "verified": false
  },
  {
    "id": 33,
    "title": "La Trobe Teaching Excellence Day",
    "uni": "latrobe",
    "date": "2026-10-08",
    "type": "showcase",
    "desc": "Teaching innovation and student success.",
    "verified": false
  },
  {
    "id": 34,
    "title": "Newcastle Education Innovation Symposium",
    "uni": "newcastle",
    "date": "2026-09-09",
    "type": "symposium",
    "desc": "Regional engagement, WIL, STEM reform.",
    "verified": false
  },
  {
    "id": 35,
    "title": "UOW Teaching & Learning Forum",
    "uni": "uow",
    "date": "2026-10-22",
    "type": "conference",
    "desc": "Authentic assessment, digital literacy.",
    "verified": false
  },
  {
    "id": 36,
    "title": "Macquarie Learning Innovation Week",
    "uni": "macquarie",
    "date": "2026-09-28",
    "endDate": "2026-10-02",
    "type": "week",
    "desc": "Five days of workshops and showcases.",
    "verified": false
  },
  {
    "id": 37,
    "title": "Adelaide University T&L Showcase",
    "uni": "adelaide",
    "date": "2026-10-14",
    "endDate": "2026-10-15",
    "type": "showcase",
    "desc": "First full-year showcase post-merger.",
    "verified": false
  },
  {
    "id": 38,
    "title": "Flinders Teaching Awards & Showcase",
    "uni": "flinders",
    "date": "2026-11-18",
    "type": "showcase",
    "desc": "Teaching awards and poster showcase.",
    "verified": false
  },
  {
    "id": 39,
    "title": "CDU Northern Teaching Symposium",
    "uni": "cdu",
    "date": "2026-08-26",
    "type": "symposium",
    "desc": "First Nations pedagogies, remote learning.",
    "verified": false
  },
  {
    "id": 40,
    "title": "ECUlture 2026",
    "uni": "ecu",
    "date": "2026-11-23",
    "type": "conference",
    "desc": "ECU's annual L&T conference (Centre for Learning & Teaching) — \"Celebrating innovative and inclusive teaching\". Joondalup + online.",
    "url": "https://www.ecu.edu.au/conferences/overview",
    "verified": true
  },
  {
    "id": 41,
    "title": "VU Block Model Symposium",
    "uni": "vu",
    "date": "2026-09-16",
    "type": "symposium",
    "desc": "VU Block Model Academy.",
    "verified": false
  },
  {
    "id": 42,
    "title": "WSU Teaching Showcase",
    "uni": "wsu",
    "date": "2026-10-29",
    "type": "showcase",
    "desc": "Community-engaged teaching.",
    "verified": false
  },
  {
    "id": 43,
    "title": "UC Teaching Innovation Forum",
    "uni": "canberra",
    "date": "2026-09-30",
    "type": "conference",
    "desc": "Connected learning, micro-credentials.",
    "verified": false
  },
  {
    "id": 44,
    "title": "JCU Tropical Teaching Week",
    "uni": "jcu",
    "date": "2026-10-12",
    "endDate": "2026-10-16",
    "type": "week",
    "desc": "Place-based education, marine science pedagogy.",
    "verified": false
  },
  {
    "id": 45,
    "title": "CSU Regional Education Showcase",
    "uni": "csu",
    "date": "2026-11-04",
    "type": "showcase",
    "desc": "Regional, rural, remote education.",
    "verified": false
  },
  {
    "id": 46,
    "title": "UNE Teaching Excellence Showcase",
    "uni": "une",
    "date": "2026-11-11",
    "type": "showcase",
    "desc": "Online and distance education innovation.",
    "verified": false
  },
  {
    "id": 47,
    "title": "CQU Tertiary Teaching Online Conference",
    "uni": "cqu",
    "date": "2026-08-25",
    "endDate": "2026-08-27",
    "type": "conference",
    "desc": "Three-day online conference — \"Teaching practice becomes scholarship by learning through design.\" Five themes (Collaboration & Belonging, AI-Enhanced L&T, Contemporary Assessment, Professional Identity, Students as Partners); live-streamed + recorded. Hosted by Academic Board & Learning & Teaching Futures.",
    "url": "https://lts.cqu.edu.au/conf/",
    "verified": true
  },
  {
    "id": 48,
    "title": "FedUni Teaching & Learning Showcase",
    "uni": "federation",
    "date": "2026-11-18",
    "type": "showcase",
    "desc": "Teaching across campuses.",
    "verified": false
  },
  {
    "id": 49,